{
  "documentId": "500123",
  "name": "Example Title",
  "fileExtension": "example_value",
  "documentBase64": "example_value",
  "remoteUrl": "https://www.example.com",
  "order": "example_value",
  "pages": "example_value",
  "display": "example_value",
  "includeInDownload": "example_value",
  "transformPdfFields": "example_value"
}